naziv,opis,datum_od,stevilo,sifra_prizorisca,cluster_pca,center_distance_pca,cluster_tsne,center_distance_tsne
Million Ear (NL/SLO),glasben formacija nastal rotterdam nenehen spreminjajoč improviziran zvočen pokrajina vključevati besedilo poezija glasben smisel združevati rapa rocka jazz ambientalen avantgarden nois element million ear črpati navdih umetnik preteklost sodobnost sopostavljati filozofski političen besedilo živ glasba glasben tradicija spontan improvizacijski izraz zgledovati ustvarjalec giti scotti heron day lion robert glasper experiment clipping izraz razvijati smer glasben krajina izključen improviziran zmeraj preplet besedilo zato koncert million ear razlikovati prejšnji zasedba januar izdati oceanica stati založba kamizdati bend sestavljati filippos glinavos kitara zadolžen besedilo rok zalokar klaviatura različen priložnost pridružiti različen bobnar tokrat andra manzona after swaguljčica dvmir borek mondijati resen koncert poleten swaguljar klasik borek premieren dvmir mondijati kolektiv snifa jutro frišen hip hop kvaliteten trap iti vstopnina musica policy hip hoprockjazznois primer slab vreme prireditev potekati dvorana pričetek,2019-07-19 21:00:00,108,356008681090989.0,1,0.05761148235697815,1,0.9233038872906297
Swaguljčica,dvmir borek mondijati čakati poleten swaguljar klasik borek premieren dvmir mondijati kolektiv snifa jutro frišen hip hop trap iti swaguljčica leten vrt glasben formacija nastal rotterdam nenehen spreminjajoč zvočen pokrajina vključevati besedilo poezija glasben smisel združevati rapa rocka jazz nois element vstopnina musica policy hip hoptrapa,2019-07-19 23:55:00,221,356008681090989.0,4,0.02737371557525283,1,0.9396576642016765
"Lublana à la carte: Klemen Klemen, Murat&Jose, Doša",carta ponudba jedilnik tokrat tokrat prisegati domač lublanski dobrota večer poezija skupaj plečnikov klet spremeniti gurmanski destinacija ljubitelj hip hop rapa okus lačen ostal jedilnik kleme kleme murati jos doš čakati večer hiphop rapa klasik ljubljanski vstopnina infa rezervacija infa plecnikpubs,2019-08-24 21:00:00,612,252722888963357.0,5,0.08024341712500466,1,1.6436022297695607
MRIGO 14.12. Vse Z Ledom Party / Max Klub Velenje,mriga led party dje zeds sladica set sunnysun hip hop mriga vseset liv rapa feati surpris klub max velenje veselje vabiti led obljubljati dje sunny sun poskrbeti hip hop klasik dje zeds sladica mriga burek poseben vseseti poklon živ svet legenda odrepati ghet vstopnina welcom drinka led,2019-12-14 21:00:00,280,234616743271933.0,3,0.04131965144557682,1,1.9212260835887074
Karaoke večeri @CMK,glasilka zapeti izbrati komad odkriti glasbenik volja imeti cel repertoar rocka pop italijanski zimzelen hip hop metati punka glasben nadarjen panika priti pridružiti dober družba četrtek sobota četrtek dogodek financirati cmka razpis program podpora mesten občina koper,2019-09-26 21:00:00,117,551779861642881.0,5,0.03181684845608957,1,2.252719323670242
TrNOVfest - Each One Teach One,projekt each teach sodelovanje center slovanski kultura france prešeren predstavljati dogodek hip hop showcas trnovfest sobota sklop festival trnovfesti predstavliti veščina hip hop hip hop kulturen fenomen zrasel pogorišče obubožan razdejan soseska južen bronx začetek let uveljaviti ulica odgovor brezup nasilje razvijati danes cel svet del kultura lahek postati edinstven priložnost domač kraj spoznati različen element hip hop oblika delavnica zastonj poučevanje interes možen nadaljevati reden termin dneven program grafit jama hip hop show delavnica rapa delavnica djing delavnica beatmaking delavnica breaking hip hop delavnica grafit dje whit allstayti danec cyhphra rapa dje breakinghip hop ples grafit beatmaking delavnica mentorstvo izvajati ekipa mlad hip hop glava znanje pridobljen javen zavod mlad zmaj sklop mesten inkubator mentor maruša pirnat igor večerič dje wood blaz kranjca kranske maksiti azarkevič azrati roman urek moomy marka kocjan emkej koncerten del saharey vazz mriga ghet godz banda dje toljo after party dje whit siknes vord dje toljo spontan presenečenje each teach mladinski projekt let začeti medvrstniški predajanje neformalen znanje kulturen dobrina hip hop stran mlad fantov dekle načrtovan aktivnost mlad usmeriti lasten interes skupaj oblikovati različen mladinski projekt način predstaviti kvaliteten preživljanje prost čas hkrati vključiti družba dogodek izvajati sodelovanje center slovanski kultura france prešeren dje telovadnica mesten inkubator mesten občina ljubljana projekt each teach arta production,2019-08-24 10:00:00,474,717882301739945.0,5,0.05962118022264137,1,2.493435085857426
Swaguljčica #6,tschimy pow whit liti ris ljub špelunka avgustovski edicija nov klubski serialka čakati masten trapa hip hop beati nov produkcija podtalen mali bolj mainstremovski swaguljar palček noč izpolnjevati glasben želja pomota oćiti vstopnina vstop prost polnoč kasneje musica policy hip hoptrapa,2019-08-16 23:00:00,180,356008681090989.0,5,0.05679717509693062,1,2.4967644801860396
Dobrodelni gala hip hop koncert za Gala,petek urban garden odviti super dogodek dobrodelen nota reper ostal predstavnik hip hop kultura šir slovenija odločiti stopiti skupaj dober namen skupen moč pripraviti pester hip hop dogodek začeti popoldanski ura lahek mlad udeležiti brezplačen delavnica mentor predstaviti različen področje hip hip kultura učiti osnova hip hop ples breakdanceo osnova dje pisanje rima grafitiranje dober počutje dober vzdušje starš mali star otrok poskrbeti dje pestriti izbor hip hop hit stemniti oder zasesti reper zakuriti mikrofon predstaviti del pripraviti after party odviti notranji prostor urban garden vstopnina dogodek cel dogodek volja škatla kjer lahek zmožnost prispevati nujen potreben operacija dečko gati celoten zbran prispevek prevzeti galov družina dan dogodek nastopajoč mentor otroški delavnica odpovedovati honorar organizator nadvsem hvaležen pridružiti skupen moč pomagati galo nastopajoč damza utrip emkej triiipel zima makedoner anzzh semch dje dje zapa dje splifa ostal organizator samson beris damjan damza praštati urban garden hyp program otroški delavnica udeležen razporediti skupina skupina spoznavati osnova hip hop ples mentorstvo nik jacquelina vrabič osnova breakdanec mentorstvo bor rehek friti osnova dje mentorstvo blaž kranjec pisanje rima mentorstvo ren strgar grafitiranje mentorstvo žati planišek delavnica trajati minuta imeti kratek pavza čas imeti mlad razpolaga domač sok prigizek otrok sam odločiti najbolj pritegniti sam odločiti delavnica kjer mentor naučiti kratek koreografija spisati skupaj pesem pografitirati platno preizkusiti djanje lahek mlad predstaviti velik oder čas pozabiti starš mama lahek obiskati kratek masaža magičen prst peter oče segreti kuhan vino kostanj,2019-11-08 15:00:00,422,140692086782618.0,6,0.0361933395699759,1,2.5141325515258734
"Banga Elements: Smoke Mardeljano, Eko, Each One Teach One",bang elements hip hop koncert smok mardeljan srba predstavitev album rapa surov nastop festival kunigunda nastopiti legendaren stok velenje vrač najprepoznaven balkanski reper smok mardeljan mnog domač raper označiti dober reper balkan otrok neizprosen beograjski beton vzrok izreden trd stil odstop old school edin pravi hiphop eka predstavitev album bad boy velenski princ velenski ulica včasih divjati beton danes oder strel rima opisovati zgodba življenje prvenec bad boy velenski opisovati surov življenje asfalt warm cyphra wuči galič beati set toljo toljo dje set plesen cyphra toljo dje set rapa nastop sara ati sal wuči mario jaš janča żen siknes toljo open mica each teach mladinski projekt medvrstniški predajanje neformalen znanje kulturen dobrina hip hop različen lokalen skupnost celoten slovenija vstopnica predprodaja dan koncert predprodajen mesto olaiis trafik omv bencinski serviseti šanek klub emec placa,2019-11-15 21:00:00,233,175396332480674.0,4,0.020505878142370468,1,2.703359662700787
Urbana Scena /// Avdicija za hip hop skupine in projektno sk.,drag plesalec gibalec vljuden vabiti plesen avdicija potekati nov prostor dunajski cesta avdicija potekati sklop avdicija hip hop skupina avdicija hip hop skupina potekati struktura plesen delavnica kjer kreativen raziskovati princip improvizacija učiti osnoven tehnika ustvariti kratek plesen material delavnica voditi naca novak gašper kunšek alexandra mathiass tesch skupina razvrstiti plesalec glede znanje interes skupina dobiti mentor spremljati celoten sezona sezona načrtovati udeležba velik koreografski tekmovanje festival plesen battel avdicija projekten skupina scena avdicija hip hop skupina prirejati avdicija projekten skupina kjer vabiti plesalkeplesalec igralkeigralec performerje akter ustvarjanje nov slovenski performativen plesnogledališki skupina scena izbran kandidatikandidatek ustvarjati sodelovati skupaj mentorstvo žigan krajnčan gašper kunški kasneje povabljen koreograf režiser sezona načrt izvedba velik interdisciplinaren predstava dogovor član projekten skupina uresničevanje ideja avdicija potekati sklop sklop zasnovan plesnoperformativen workshop poudarek kreativnost dojemljivost tehnika improvizacija sklop videti posameznik zato prositi pripraviti performans ples glasba igra govor cirkus dolžina mina timelina avdicija hip hop skupina let avdicija hip hop skupina let avdicija projekten skupina scena avdicija hip hop skupina let avdicija hip hop skupina let avdicija projekten skupina scena avdicija brezplačen prijava sprejemati avdicijascena gmailc primer dan datum avdicija udeležiti prositi pisati avdicijascena gmailc izreden termin povedati naprej prijatelj videti,2019-08-24 11:00:00,146,2137949339820594.0,4,0.05491554463984912,1,3.0039854812873172
K4 Live : Doša x Vazz,liv oder zavzeti poljanski rimoklepač rap konec doš slovenski hip hop scena predstaviti dvojec deuca ustanoviti skupaj anže kacafura prvič dueta pojav slovenski hip hop kompilacija fiv minutes fama narodov blagor komad dost mama skaldba priromati mednaroden hip hop kompilacija speaking tongues deuca zadnjič pojaviti skupaj kompilacija lublana podtalen sodelovati takrat mali manj znan zlatek doš nato sodelovati večina pomemben ime domač rapa scena nikolovski klemen klemen let ustanoviti založba datura let zatem izdati dolgometražec mementa mora odmevati znan rima fuknt sredinec zrak skupaj naca jordan bass bmd anža metoda breskvara boben sestavljati delen banda slednji lahek razkazovati oktober klet vazz vodilen rimoklepač mlad generacija suveren izraz piliti številen freestyti tekmovanje open mic prednastop prvenec individuum izpljuniti lani pozimi jesen prihajati plat naslovljen jacoba ljubljančan nastop ponos nastopanje doš družiti pogled metropola ljubljana undergrounda klub kersnikov ljubljana vstopnina entranec predprodaja olaiic vhod infa infa garderoba lost founda gmailc,2019-10-10 20:00:00,538,126700024052347.0,4,0.04149021023214534,1,3.504178850533907
TRAP IST TOT 2.0,malign glasba vedno vztrajati razprodan premiera klik bunta leto izkazati svojevrsten prelomnica odvijanje domač mejnopopularen glasba ponoven spomniti preminul družben žanr nikoli obstajati zazreti eksistenca potomstvo tokraten spomladanski proslava prihajati opomnik trenuten zatišje lokalen klubski noviteta mali panek plesen glasba zlomljen srce liv retfatlanta osijek dje lineup cltr bojler yngfirefly dvs zvest izviren logika dogodek tokrat ljubljanski publika premieren predstaviti mlad emotivca osjek prvenec uspel postati ljub upandcoming izvajalec uveljaviti srbski turbofolk liga obenem pobratiti konstruktiven pohvala relevanten hrvaški glasben recenzent obskuren objava youtub zadnji let vriniti regionalen headliner razprodan dvorana trending streaming platformv slog balkanski genz pandan kidcudij dober let razvijati konceptualen komad patos vokati soočati derivati funek rap bje kombinirati vanzemaljski sintetizator psihedeličen progresija delovati ustanoven član pseudolejbsti redfatlanta skupina prijateljev dislociran slavonija družiti glasben eksperiment slednji številen gostovanje najbolj profilirati massiti savaga spremljati tokrat tokraten pogreben slavje obenem uraden comebacka rezident dogodek leto trajajoč performativen hiatus vračati nov glasba brutalen interneti senzacija introvertiran spinoff izdaja hrvaški producent sha ljubljanski avantgarden interesen skupina obračati bolj elektronski zvok koncert kaniti konsistenten prelet vrhunec dosedanji opus popolnost izvesti nov kompozicija izdaja obljubljen sam dogodek večer razigran otvoriti yngfirefly mlad odrešitelj štajerski posthiphop produkcija znan zvočen opremljevalec liričen eskapadati dvojec oygn uraden after program pripadel dvsje siv eminenec lokalen klubski srenje kombinacija osrednji person plesen žanrski transgresija domač flor zmeraj mlad dama cltr vstopnina earlybird sax pub reden predprodaja waysax pub gati hala dogodek dan dogodek cgp shoutouti matija medved max obož,2020-04-03 22:00:00,358,356008681090989.0,1,0.0773096187499914,1,3.5470482851640353
"Matter (support by Semch, Necropsi, Reps, Lazar)",matter matter kamniški trojec edinstven sodoben ant raperski slog postapokaliptičen boybanda meja ironija abstrakten beseden igra nesmiseln domislica konkreten družben angažmajati zvok kamniški gora abstrakten zmeda oblak rapa rapa mrk flow matter dvoživka živeti življenje čist pop zapleten podzemlje lucidnost naključen zmeda kamnikfoličen lokalnost abstrakten poezija slovenski raper družiti izključen dejstvo pogost poseči medij videospot jasen stilski pečat povezava youtuba support semch dje necrops reps lazar vstopnina predprodaja eura dan koncert eura,2020-02-29 21:00:00,504,334501009947618.0,5,0.050020276407119736,1,3.6306571964883143
Rap VS Poezija = Drill & Masayah VS dr. Igor Saksida,cenjen pefovec pefovka pripravljen pravi liričen spektakel pripravljati koncert drill masaya igor saksiti rapper drill let steber obalen hip hop scena bolj uveljvalj drugje slovenija imeti sola album stil seči klasičen boombap plata nuklearen zima tramontan beseda trap zadnji izdan album ribolov dinamit zadnji let nanizati sodelovanje pop leo sirka reperski scena emkej mrigz ghet kratek izdati singel bolan doktor prihajajoč album peter verjetneje izid naslednji leto masaya rapperek ankaran hip hop ukvarjati petje igranje kitara mentor bolan doktor drill nastop razen oder slovenija izdati singla pust bla sola album lahek pričakovati naslednji leto igor saksid profesor mladinski pedagoški fakulteta koper ljubljana prost čas velik privrženec rap podpornik slovenski hip hop scena sam velik ljubitelj poezija ustvarjati nastop trkaj pravi kuhati drill masaya javen znan whati deal know drill,2019-12-11 20:00:00,354,551779861642881.0,1,0.04567944018841102,1,4.410145327986772
La Noche Caliente / Edicion De Amor,letos praznovati dan zaljubljenec vroč ritem noch calient mavrica karibski zvok premešan hip hop radijski pop reggeton sals bachati latinski vibracija ulica miamio new yorek lajati večen klasik rhyth night bailanda vamos play latinski bad boys shakira rickyje gospa lopeza soboten jutro zapeljati brat dvojček dean mik dean microfona dje dragon dober namig glasben želja dobiti poslušanje oddaja hor feliza radio salomona nasvet obisk šanek naročiti flaming verjeti dovolj klub squara kongresen trg infa miza,2020-02-14 23:00:00,210,109340347105959.0,3,0.06523735258126082,1,4.520827380769063
"123 Raps VOL 2. (Mrigz'n'Ghet, Fankadelik, Mirko and Comp.)",glasben društvo raps vol ponoven poletje posloviti hiphop stil oder massiv prihajati kranje hiter jezik slovenski mikrofon imeti obširen paleta sodelovanje izdan projekt prvič lahek slišati kranjski mixtape kjer ostal ambasador takraten kranjski scena večinoma ustvarjati srbohrvaščina angleščina producent robs večkrat oder lahek videti haris pilton mali izvedba sedaj izdati album mica creat nato sam imeti paleta videospot lahek pogledati youtube sodelovanje gravity medio kranjski rok kadoič mirka grozny mirka vorkapić raper atiti dejanski borec ring zdaj postati mirka grozny nov plošča afera majda holce najbolj hit šmorna remix kjer trgati beseda zlatek doša ostal vroč ime slovenski scena prvič tržič mirka grozny načitan raper pridiga klasičen rapa plat afera majda holce pogost ukvarjati hiphop battles avtopoetika referenca slava hiphop pluralen širina slava jezik poseben sramovati zavezanost tradicija presegati obenem znotraj raztezati slovenski pol urban središče podgurski dolenjski vas oštarija vseeno grozny zgodnji ntok dvig ruralen mrak okolje potopljen opevati legenda komičnost nikjer zavrniti mih šalehar kmet taborišče brutalen prežati pogost očiten napaka čefura skrivati obstoj besedilo spajati svetoven vojen spajajoč mesten podeželski slovenski čefurski zbliževanje zapleten poln smeh solza strah žurek hiphop sila osišče soočati razlika znati kazati problem zapadati defetizem hiphop hkrati kultura humor poln zaživeti prazen ciničen način življenje svojstven metafizik tarpa semch lazar frontiza rapsti ekipa najprej oder kranjski mcje semch supporter lazar semchov epje prihajati semchlajf nato oder zavzeti majka tržič tarpet paleta mešan komado album raps miseln teater bolj zanimiv mešalka gramofon družba delati tjuš dje danaj fant vedno domač tla pripravlati presenečenje majka poprijeti mrigz anda ghet najbolj uigrati dvojec slovenski hiphop prihajati glaven središče vrelišče domač rap velenje mrigz ghet let postreči paket benger mrigz ghet hitz član razširjen družina velebor snajp balkon bang radio mriga najprej voditelj radijski oddaja hip hop vizija nato dje mali raper hip hop dogodek rap prebiti led let reprazent slediti album poznati štrleti komad šak zrak king nered sok prasec vedeti prelomen let izšel mrigz ghet hitz zgoditi sodelovanje zlatek emkej šmorna rmx tekoche ker album ghet veljati dober slovenski album spleten portalo balkan hip hop let hip hop album let let video dober momec mriga gostovati nemir prejeti nagrada mtv adrio skupina velebor emkej mriga ghet mit izdati album božji gamada izstopati singla lifting mesto točka rtv zaden komad božji gamada video lahk znajti lestvica točka rtv slediti odmeven sodelovanje trkati nipka emkej frenkio general odreti deliti legenda onyx tang clan mop das efx let skrb radio oza dogodek cel slovenija domač hip hop dje nastopiti klub festival dežela raper pravtak obstajati oder slovenija repati krivec velik hip hop dogodek hip hop reunion velenje festival kunigunda ghet ghet mca vedno zabaven gledati oder zagotovo pobrati dober for ameriški nastopanje let mrigot izdati mrigz nghet hitz nato preseliti ljubljana kjer povezati ballau skupaj izdati album ghet balla nato izdati sola album velik hitič blok snajper letos izdati skupen album naslov gorenjski plaža prvič paleta hito album lina dje showcas gengst grega reps makedoner esey massiv lies urban scena showcas mirka grozny dje danaj bagor mrigz nghet karta dan dogodek zvedti,2019-09-14 18:00:00,378,312072112299316.0,1,0.029309050420612517,1,4.5227763603285025
La Noche Caliente / Numero Dos,ready ponovitev najbolj strasten zabava klub squara noch calient mavrica karibski zvok premešan hip hop radijski pop reggeton sals bachati latinski vibracija ulica miamio new yorek lajati večen klasik rhyth night bailanda vamos play latinski bad boys shakira rickyje gospa lopeza soboten jutro zapeljati brat dvojček dean mik dean microfona dje dragon dober namig glasben želja dobiti poslušanje oddaja hor feliza radio salomona nasvet obisk šanek naročiti flaming verjeti dovolj klub squara kongresen trg infa miza,2020-01-17 23:00:00,229,109340347105959.0,3,0.04989880237572719,1,4.526051941976846
La Noche Caliente,ready ponovitev najbolj strasten zabava klub squara noch calient mavrica karibski zvok premešan hip hop radijski pop reggeton sals bachati latinski vibracija ulica miamio new yorek lajati večen klasik rhyth night bailanda vamos play latinski bad boys shakira rickyje gospa lopeza soboten jutro zapeljati brat dvojček dean mik dean microfona dje dragon dober namig glasben želja dobiti poslušanje oddaja hor feliza radio salomona nasvet obisk šanek naročiti flaming verjeti dovolj polnoč zastonj vstop klub squara kongresen trg infa miza,2020-03-13 23:00:00,186,109340347105959.0,3,0.03877601845036068,1,4.527587154852284
MC Members feat. Everything Goes - PET 7/2/20,ftrgancija vrač dje ekipa poskrbeti zadihati komad prijatelj metelkov everything goes voziti punka rocka metati noreti zjutraj karaok vmes bit sindikalen cena pijača vstop nor žurka mogoč članski izkaznica imeti izgubiti lahek dobiti dan šanek mcje dan dogodek potem zrihtati dom pozabiti stati mcje medtem noter zabavati fajna amen kamen,2020-02-07 18:00:00,239,615833088558835.0,0,0.061293013618498246,1,4.5518098059654495
MC Members feat. Everything Goes - SOB 5/10/19,ftrgancija dje ekipa tokrat poskrbeti zadihati komad prijatelj metelkov everything goes odpičen žurer žila teči alternativen kri štajerski poseben voziti punka rocka metati topel priporočati obleči pretopel karaok vmes bit sindikalen cena pijača vstop nor žurka mogoč članski izkaznica imeti izgubiti lahek dobiti dan šanek mcje dan dogodek potem zrihtati dom pozabiti stati mcje medtem noter zabavati fajna amen kamen,2019-10-05 18:00:00,239,615833088558835.0,0,0.059543496060709654,1,4.553426006950252
